{
	"id": "api_extract_bytes_async",
	"description": "Tests async bytes extraction API (extract_bytes)",
	"tags": ["contract", "api"],
	"document": {
		"path": "pdfs/fake_memo.pdf"
	},
	"extraction": {
		"method": "async",
		"input_type": "bytes",
		"config": {}
	},
	"assertions": {
		"expected_mime": "application/pdf",
		"min_content_length": 10,
		"content_contains_any": ["May 5, 2023", "Mallori"]
	}
}
