{
	"id": "api_batch_file_async",
	"description": "Tests async batch file extraction API (batch_extract_file)",
	"tags": ["contract", "api", "batch"],
	"document": {
		"path": "pdfs/fake_memo.pdf"
	},
	"extraction": {
		"method": "batch_async",
		"input_type": "file",
		"config": {}
	},
	"assertions": {
		"expected_mime": "application/pdf",
		"min_content_length": 10,
		"content_contains_any": ["May 5, 2023", "Mallori"]
	}
}
