{
	"id": "ocr_paddle_table_detection",
	"category": "ocr",
	"description": "Table detection and extraction with PaddleOCR.",
	"document": {
		"path": "images/simple_table.png",
		"media_type": "image/png",
		"requires_external_tool": ["paddle-ocr", "onnxruntime"]
	},
	"extraction": {
		"config": {
			"ocr": {
				"backend": "paddle-ocr",
				"language": "en",
				"paddle_ocr_config": {
					"enable_table_detection": true
				}
			},
			"force_ocr": true
		}
	},
	"assertions": {
		"expected_mime": "image/png",
		"min_content_length": 10,
		"tables": {
			"min": 1
		}
	},
	"skip": {
		"requires_feature": ["paddle-ocr"],
		"notes": "Tests table detection capability with PaddleOCR"
	}
}
