{
	"id": "config_use_cache_false",
	"description": "Tests use_cache=false configuration option",
	"tags": ["contract", "config"],
	"document": {
		"path": "pdfs/fake_memo.pdf"
	},
	"extraction": {
		"method": "sync",
		"input_type": "file",
		"config": {
			"use_cache": false
		}
	},
	"assertions": {
		"expected_mime": "application/pdf",
		"min_content_length": 10
	}
}
