{
	"id": "api_batch_bytes_sync",
	"description": "Tests sync batch bytes extraction API (batch_extract_bytes_sync)",
	"tags": ["contract", "api", "batch"],
	"document": {
		"path": "pdfs/fake_memo.pdf"
	},
	"extraction": {
		"method": "batch_sync",
		"input_type": "bytes",
		"config": {}
	},
	"assertions": {
		"expected_mime": "application/pdf",
		"min_content_length": 10,
		"content_contains_any": ["May 5, 2023", "Mallori"]
	}
}
