{
	"id": "config_force_ocr",
	"description": "Tests force_ocr configuration option",
	"tags": ["contract", "config", "ocr"],
	"document": {
		"path": "pdfs/fake_memo.pdf"
	},
	"extraction": {
		"method": "sync",
		"input_type": "file",
		"config": {
			"force_ocr": true
		}
	},
	"assertions": {
		"expected_mime": "application/pdf",
		"min_content_length": 5
	},
	"skip": {
		"requires_feature": ["tesseract"]
	}
}
